	Identifier                                : 0x11 (QSFP28)
	Extended identifier                       : 0xcc
	Extended identifier description           : 3.5W max. Power consumption
	Extended identifier description           : CDR present in TX, CDR present in RX
	Extended identifier description           : High Power Class (> 3.5 W) not enabled
	Power set                                 : Off
	Power override                            : On
	Connector                                 : 0x0c (MPO Parallel Optic)
	Transceiver codes                         : 0x80 0x00 0x00 0x00 0x00 0x00 0x00 0x00
	Transceiver type                          : 100G Ethernet: 100G Base-SR4 or 25GBase-SR
	Encoding                                  : 0x07 ((256B/257B (transcoded FEC-enabled data))
	BR, Nominal                               : 25500Mbps
	Rate identifier                           : 0x00
	Length (SMF,km)                           : 0km
	Length (OM3 50um)                         : 70m
	Length (OM2 50um)                         : 0m
	Length (OM1 62.5um)                       : 0m
	Length (Copper or Active cable)           : 50m
	Transmitter technology                    : 0x00 (850 nm VCSEL)
	Laser wavelength                          : 850.000nm
	Laser wavelength tolerance                : 10.000nm
	Vendor name                               : Arista Networks
	Vendor OUI                                : 00:1c:73
	Vendor PN                                 : QSFP-100G-SR4
	Vendor rev                                : 20
	Vendor SN                                 : ADP1838004XW
	Date code                                 : 180712
	Revision Compliance                       : SFF-8636 Rev 2.5/2.6/2.7
	Module temperature                        : 44.69 degrees C / 112.44 degrees F
	Module voltage                            : 3.2971 V
	Alarm/warning flags implemented           : Yes
	Laser tx bias current (Channel 1)         : 8.110 mA
	Laser tx bias current (Channel 2)         : 8.110 mA
	Laser tx bias current (Channel 3)         : 8.110 mA
	Laser tx bias current (Channel 4)         : 8.110 mA
	Transmit avg optical power (Channel 1)    : 0.8938 mW / -0.49 dBm
	Transmit avg optical power (Channel 2)    : 0.8945 mW / -0.48 dBm
	Transmit avg optical power (Channel 3)    : 0.9320 mW / -0.31 dBm
	Transmit avg optical power (Channel 4)    : 0.9063 mW / -0.43 dBm
	Rcvr signal avg optical power(Channel 1)  : 0.8468 mW / -0.67 dBm
	Rcvr signal avg optical power(Channel 2)  : 0.8364 mW / -0.79 dBm
	Rcvr signal avg optical power(Channel 3)  : 1.0164 mW / 0.07 dBm
	Rcvr signal avg optical power(Channel 4)  : 0.7225 mW / -1.41 dBm
	Laser bias current high alarm   (Chan 1)  : Off
	Laser bias current low alarm    (Chan 1)  : Off
	Laser bias current high warning (Chan 1)  : Off
	Laser bias current low warning  (Chan 1)  : Off
	Laser bias current high alarm   (Chan 2)  : Off
	Laser bias current low alarm    (Chan 2)  : Off
	Laser bias current high warning (Chan 2)  : Off
	Laser bias current low warning  (Chan 2)  : Off
	Laser bias current high alarm   (Chan 3)  : Off
	Laser bias current low alarm    (Chan 3)  : Off
	Laser bias current high warning (Chan 3)  : Off
	Laser bias current low warning  (Chan 3)  : Off
	Laser bias current high alarm   (Chan 4)  : Off
	Laser bias current low alarm    (Chan 4)  : Off
	Laser bias current high warning (Chan 4)  : Off
	Laser bias current low warning  (Chan 4)  : Off
	Module temperature high alarm             : Off
	Module temperature low alarm              : Off
	Module temperature high warning           : Off
	Module temperature low warning            : Off
	Module voltage high alarm                 : Off
	Module voltage low alarm                  : Off
	Module voltage high warning               : Off
	Module voltage low warning                : Off
	Laser tx power high alarm   (Channel 1)   : Off
	Laser tx power low alarm    (Channel 1)   : Off
	Laser tx power high warning (Channel 1)   : Off
	Laser tx power low warning  (Channel 1)   : Off
	Laser tx power high alarm   (Channel 2)   : Off
	Laser tx power low alarm    (Channel 2)   : Off
	Laser tx power high warning (Channel 2)   : Off
	Laser tx power low warning  (Channel 2)   : Off
	Laser tx power high alarm   (Channel 3)   : Off
	Laser tx power low alarm    (Channel 3)   : Off
	Laser tx power high warning (Channel 3)   : Off
	Laser tx power low warning  (Channel 3)   : Off
	Laser tx power high alarm   (Channel 4)   : Off
	Laser tx power low alarm    (Channel 4)   : Off
	Laser tx power high warning (Channel 4)   : Off
	Laser tx power low warning  (Channel 4)   : Off
	Laser rx power high alarm   (Channel 1)   : Off
	Laser rx power low alarm    (Channel 1)   : Off
	Laser rx power high warning (Channel 1)   : Off
	Laser rx power low warning  (Channel 1)   : Off
	Laser rx power high alarm   (Channel 2)   : Off
	Laser rx power low alarm    (Channel 2)   : Off
	Laser rx power high warning (Channel 2)   : Off
	Laser rx power low warning  (Channel 2)   : Off
	Laser rx power high alarm   (Channel 3)   : Off
	Laser rx power low alarm    (Channel 3)   : Off
	Laser rx power high warning (Channel 3)   : Off
	Laser rx power low warning  (Channel 3)   : Off
	Laser rx power high alarm   (Channel 4)   : Off
	Laser rx power low alarm    (Channel 4)   : Off
	Laser rx power high warning (Channel 4)   : Off
	Laser rx power low warning  (Channel 4)   : Off
	Laser bias current high alarm threshold   : 12.000 mA
	Laser bias current low alarm threshold    : 3.002 mA
	Laser bias current high warning threshold : 10.000 mA
	Laser bias current low warning threshold  : 4.496 mA
	Laser output power high alarm threshold   : 3.4634 mW / 5.40 dBm
	Laser output power low alarm threshold    : 0.0724 mW / -11.40 dBm
	Laser output power high warning threshold : 1.7360 mW / 2.40 dBm
	Laser output power low warning threshold  : 0.1444 mW / -8.40 dBm
	Module temperature high alarm threshold   : 80.00 degrees C / 176.00 degrees F
	Module temperature low alarm threshold    : -10.00 degrees C / 14.00 degrees F
	Module temperature high warning threshold : 75.00 degrees C / 167.00 degrees F
	Module temperature low warning threshold  : -5.00 degrees C / 23.00 degrees F
	Module voltage high alarm threshold       : 3.6304 V
	Module voltage low alarm threshold        : 2.9704 V
	Module voltage high warning threshold     : 3.4648 V
	Module voltage low warning threshold      : 3.1352 V
	Laser rx power high alarm threshold       : 3.4634 mW / 5.40 dBm
	Laser rx power low alarm threshold        : 0.0468 mW / -13.30 dBm
	Laser rx power high warning threshold     : 1.7360 mW / 2.40 dBm
	Laser rx power low warning threshold      : 0.0933 mW / -10.30 dBm
